[
  {
    "id": "feed-me-odd",
    "name": "Feed Me Odd",
    "tagline": "Des anecdotes vraies, écrites pour être lues : deux minutes par récit, une par écran.",
    "status": "production",
    "category": "IA générative",
    "tags": [
      "Pipeline IA",
      "GitHub Actions",
      "Contenu",
      "Monétisation"
    ],
    "featured": true,
    "year": 2026,
    "version": "8.27.0",
    "problem": "Produire en continu des contenus éditoriaux fiables et agréables à lire coûte cher en temps de recherche et de rédaction, et le risque d'erreur factuelle est élevé.",
    "solution": "Une chaîne éditoriale automatisée : moisson de sujets insolites sur Wikipédia et Wikidata, sélection humaine, rédaction par LLM contrainte au seul texte source, relecture, puis publication programmée sur un site et une PWA avec abonnement ou achat à vie.",
    "architecture": [
      "Pipeline en 5 workflows GitHub Actions : moissonner → écrire → contrôler → publier, plus un entretien",
      "Console d'administration statique qui pilote les workflows via un jeton GitHub à portée fine",
      "Garde-fous LLM : reprise sans repayer, estimation du coût avant exécution, score d'« insolite » pour écarter les sujets faibles",
      "Site et PWA statiques déployés sur Netlify, dédoublonnage par identifiant Wikidata"
    ],
    "ai": [
      "Claude Sonnet 5",
      "Claude Opus 5",
      "OpenAI (fournisseur de repli)"
    ],
    "apis": [
      "Anthropic API",
      "OpenAI API",
      "API MediaWiki",
      "Wikidata",
      "Polar (paiement)",
      "Netlify"
    ],
    "builtWith": [
      "Claude Code"
    ],
    "highlights": [
      "Catalogue de plusieurs milliers de sujets",
      "Une fiche n'est jamais payée deux fois",
      "Abonnement et achat à vie"
    ],
    "repo": "https://github.com/engoB/curio",
    "repoPrivate": true,
    "demo": "https://www.feedmeodd.com",
    "demoLabel": "Visiter",
    "image": "projects/feedmeodd.webp",
    "imageKind": "desktop",
    "accent": "#60a5fa"
  },
  {
    "id": "multix-arena",
    "name": "Multi X Arena",
    "tagline": "Les tables de multiplication deviennent un jeu d'arène.",
    "status": "production",
    "category": "Éducation",
    "tags": [
      "PWA",
      "Jeu",
      "Gamification",
      "TypeScript"
    ],
    "featured": true,
    "year": 2026,
    "version": "4.6.13",
    "problem": "Réviser les tables par récitation lasse vite les enfants ; les applis existantes sont souvent pleines de publicités ou exigent un compte.",
    "solution": "Un jeu éducatif qui transforme la mémorisation en aventure : 24 niveaux, héros à pouvoirs, progression mémorielle et duels locaux sur le même écran.",
    "architecture": [
      "PWA installable, 100 % hors ligne, sans compte, sans pub ni suivi",
      "Progression locale exportable, mises à jour qui n'interrompent pas une partie",
      "« Atelier » séparé pour personnaliser habillage, sons et modes via un pack.json",
      "Script de vérification de livraison (version, bundle, service worker, assets)"
    ],
    "ai": [],
    "apis": [
      "Service Worker",
      "Web App Manifest"
    ],
    "builtWith": [
      "Claude Code"
    ],
    "highlights": [
      "24 niveaux · 6 mondes · 10 héros",
      "Modes solo et duel local"
    ],
    "repo": "https://github.com/engoB/MultixArena",
    "demo": "https://engob.github.io/MultixArena/",
    "demoLabel": "Jouer",
    "image": "projects/multix.webp",
    "imageKind": "mobile",
    "accent": "#f59e0b"
  },
  {
    "id": "tbm-tram-radar",
    "name": "TBM Tram Radar",
    "tagline": "« Est-ce que je l'ai ? » — le tram de Bordeaux en temps réel, selon votre allure.",
    "status": "production",
    "category": "Mobilité",
    "tags": [
      "PWA",
      "Open Data",
      "Temps réel",
      "iOS"
    ],
    "featured": true,
    "year": 2026,
    "version": "5.9.1",
    "problem": "Les applis de transport donnent l'horaire de passage, pas la réponse utile : ai-je le temps d'attraper ce tram à pied, depuis là où je suis ?",
    "solution": "Un seul écran : station la plus proche, sens choisi, et verdict en direct en croisant le temps réel officiel TBM avec un vrai itinéraire piéton et la vitesse de marche de l'utilisateur.",
    "architecture": [
      "PWA sans framework, service worker hors ligne et mises à jour sans rechargement surprise",
      "Tracés et couleurs régénérés chaque nuit depuis le GTFS TBM par GitHub Actions (build seulement si les données changent)",
      "Relais CORS optionnel sur Cloudflare Workers",
      "Empaquetage iOS natif avec Capacitor (géolocalisation, notifications, haptique)"
    ],
    "ai": [],
    "apis": [
      "SIRI Lite TBM (temps réel)",
      "GTFS TBM",
      "OSRM (itinéraires piétons)",
      "OpenStreetMap / CARTO",
      "Cloudflare Workers"
    ],
    "builtWith": [
      "Claude Code"
    ],
    "highlights": [
      "Données ouvertes Bordeaux Métropole",
      "Version web + app iOS"
    ],
    "repo": "https://github.com/engoB/TBMTramRadar",
    "demo": "https://engob.github.io/TBMTramRadar/",
    "image": "projects/tbm.webp",
    "imageKind": "mobile",
    "accent": "#3b82f6"
  },
  {
    "id": "proofshot",
    "name": "ProofShot",
    "tagline": "Capturer, annoter, partager — en 30 secondes. Extension Chrome.",
    "status": "production",
    "category": "Productivité",
    "tags": [
      "Extension Chrome",
      "Local-first",
      "SaaS"
    ],
    "featured": false,
    "year": 2026,
    "problem": "Documenter un bug ou rédiger un tutoriel demande de jongler entre capture, éditeur d'image et mise en page, souvent avec des outils qui envoient les images dans le cloud.",
    "solution": "Une extension qui capture, annote (flèches, flou, numéros) et assemble des tutoriels ou comparatifs avant/après, sans que rien ne quitte l'appareil.",
    "architecture": [
      "Stockage 100 % local dans le navigateur, aucun compte ni pistage",
      "Modèle freemium : licence Pro à vie, seule connexion sortante = validation de clé",
      "Exports PNG, JPG, WebP, PDF et GIF animé"
    ],
    "ai": [],
    "apis": [
      "Chrome Extensions API",
      "Chrome Web Store"
    ],
    "builtWith": [
      "Claude Code"
    ],
    "highlights": [
      "Publiée sur le Chrome Web Store"
    ],
    "repo": "https://github.com/engoB/proofshot",
    "demo": "https://engob.github.io/proofshot/",
    "demoLabel": "Site",
    "image": "projects/proofshot.webp",
    "imageKind": "desktop",
    "accent": "#6366f1"
  },
  {
    "id": "pokevault",
    "name": "PokéVault",
    "tagline": "Classeur de cartes Pokémon rapide, hors ligne, avec cotes Cardmarket.",
    "status": "production",
    "category": "Collection",
    "tags": [
      "PWA",
      "Hors ligne",
      "Data",
      "Tests"
    ],
    "featured": false,
    "year": 2026,
    "version": "4.6.0",
    "problem": "Suivre une collection de dizaines de milliers de cartes, avec les bons visuels et des prix fiables, sans compte ni abonnement et même sans réseau.",
    "solution": "Une PWA locale-first qui agrège plusieurs catalogues avec une chaîne de repli stricte pour les illustrations, et qui distingue toujours un prix inconnu d'un prix nul.",
    "architecture": [
      "JavaScript natif sans CDN ni compilation obligatoire, bundle autonome",
      "Cache IndexedDB + service worker, collection jamais migrée de façon destructive",
      "Repli d'images en 5 niveaux avec rejet des correspondances ambiguës",
      "Scripts Node de moisson et d'assemblage de packs d'images, tests node --test en CI"
    ],
    "ai": [],
    "apis": [
      "TCGdex (FR/EN)",
      "Pokémon TCG API",
      "Cotes Cardmarket"
    ],
    "builtWith": [
      "Claude Code"
    ],
    "highlights": [
      "Recherche sur six catalogues",
      "Import/export JSON par fusion, sans double comptage"
    ],
    "repo": "https://github.com/engoB/PokeTest",
    "demo": "https://engob.github.io/PokeTest/",
    "image": "projects/pokevault.webp",
    "imageKind": "mobile",
    "accent": "#2dd4bf"
  },
  {
    "id": "auraplan",
    "name": "AuraPlan Studio",
    "tagline": "Roadmap, Kanban, planning et notes dans un seul fichier.",
    "status": "en-cours",
    "category": "Productivité",
    "tags": [
      "Gestion de projet",
      "Chiffrement",
      "Local-first"
    ],
    "featured": false,
    "year": 2026,
    "problem": "Les outils de gestion de projet type Jira sont lourds pour un usage personnel et hébergent les données chez un tiers.",
    "solution": "Un studio de planification en une page, dont les données sont synchronisées dans un dépôt GitHub personnel, compressées et chiffrées côté navigateur.",
    "architecture": [
      "Application monofichier, aucune dépendance serveur",
      "Synchronisation via l'API GitHub Contents : chaque sauvegarde est un commit",
      "Chiffrement AES-GCM avec clé dérivée PBKDF2 du mot de passe, compression native du navigateur"
    ],
    "ai": [],
    "apis": [
      "GitHub REST API",
      "Web Crypto API",
      "Compression Streams API"
    ],
    "builtWith": [
      "Claude Code"
    ],
    "highlights": [
      "Vues Roadmap, Kanban, Timeline, Notes"
    ],
    "repo": "https://github.com/engoB/EngoJira",
    "demo": "https://engob.github.io/EngoJira/",
    "image": "projects/auraplan.webp",
    "imageKind": "desktop",
    "accent": "#a78bfa"
  },
  {
    "id": "oasis-the-hunt",
    "name": "OASIS — The Hunt",
    "tagline": "Catalogue films & séries doublé d'une chasse au trésor quotidienne.",
    "status": "prototype",
    "category": "Divertissement",
    "tags": [
      "Jeu",
      "Chiffrement",
      "Génération procédurale"
    ],
    "featured": false,
    "year": 2026,
    "problem": "Rendre la découverte d'un catalogue de films et séries ludique, avec une énigme par jour impossible à tricher en lisant le code source.",